{
    "$schema": "http://json-schema.org/draft-07/schema#",
    "type": "object",
    "additionalProperties": false,
    "definitions": {
        "rule": {
            "oneOf": [{
                "description": "ğŸŠPutout rule\n\n\"off\" means rule is off\n\"on\" means it is a on\n",
                "enum": [ "on", "off"]
            }, {
                "type": "array",
                "items": [{
                    "enum": [ "on", "off"]
                }, {
                    "type": "object"
                }],
                "minItems": 2,
                "additionalItems": false
            }]
        },
        "rules": {
            "description": "ğŸŠPutout comes with a large number of rules. You can modify which rules your project uses.",
            "type": "object",
            "patternProperties": {
                "^.*$": {
                    "$ref": "#/definitions/rule"
                }
            }
        }
    },
    "properties": {
        "parser": {
            "description": "Tell ğŸŠPutout which parser to use",
            "type": "string"
        },
        "formatter": {
            "description": "Choose the way to show information about errors found",
            "type": ["string", "array"]
        },
        "processors": {
            "description": "Tell ğŸŠPutout which processors to use to support file types other then JavaScript",
            "type": "array",
            "uniqueItems": true,
            "items": {
                "type": "string"
            }
        },
        "ignore": {
            "description": "Tell ğŸŠPutout to ignore specific files and directories.",
            "type": "array",
            "uniqueItems": true,
            "items": {
                "type": "string"
            }
        },
        "match": {
            "description": "Allows to match rules for files and folders, specified by glob patterns.",
            "type": "object",
            "patternProperties": {
                "^.*$": {
                    "$ref": "#/definitions/rules"
                }
            }
        },
        "plugins": {
            "description": "Tell ğŸŠPutout which plugins to load",
            "type": "array",
            "uniqueItems": true
        },
        "rules": {"$ref": "#/definitions/rules"}
    }
}
