{
    "parser": "babel",
    "formatter": "dump",
    "match": {
        "madrun.js": {
            "madrun/*": true
        },
        "bin": {
            "remove-process-exit": false,
            "remove-console": false
        },
        "test|.spec.js": {
            "remove-only": true,
            "remove-skip": true
        }
    },
    "ignore": [
        "node_modules",
        "fixture"
    ],
    "rules": {
        "madrun/*": false,
        "convert-esm-to-commonjs": false,
        "convert-commonjs-to-esm": false,
        "remove-only": false,
        "remove-skip": false,
        "putout": false
    },
    "plugins": [
        "apply-destructuring",
        "extract-object-properties",
        "extract-sequence-expressions",
        "madrun",
        "remove-debugger",
        "remove-only",
        "remove-skip",
        "remove-process-exit",
        "remove-console",
        "remove-empty",
        "remove-unused-variables",
        "remove-unused-private-fields",
        "remove-unused-expressions",
        "remove-useless-variables",
        "remove-constant-conditions",
        "remove-boolean-from-logical-expressions",
        "remove-nested-blocks",
        "split-variable-declarations",
        "convert-esm-to-commonjs",
        "convert-commonjs-to-esm",
        "convert-apply-to-spread",
        "convert-arguments-to-rest",
        "convert-object-assign-to-merge-spread",
        "convert-binary-expression-to-boolean",
        "convert-math-pow",
        "convert-for-each-to-for-of",
        "merge-destructuring-properties",
        "strict-mode",
        "putout"
    ]
}

